{"schema_version":1,"diagram_type":"architecture","meta":{"title":"库存预留系统","output":"diagram.html","quality_profile":"showcase","locale":"zh-CN","viewBox":[0,0,1000,560]},"components":[{"id":"shop_ui","type":"frontend","label":"Shop UI","sublabel":"结算界面","pos":[40,60],"size":[150,64]},{"id":"order_api","type":"backend","label":"Order API","sublabel":"订单接口","pos":[300,60],"size":[150,64]},{"id":"inventory_service","type":"backend","label":"Inventory Service","sublabel":"库存服务","pos":[560,60],"size":[170,64]},{"id":"inventory_db","type":"database","label":"Inventory DB","sublabel":"库存库","pos":[560,240],"size":[170,64]},{"id":"payment_service","type":"backend","label":"Payment Service","sublabel":"支付服务","pos":[300,240],"size":[150,64]},{"id":"audit_log","type":"database","label":"Audit Log","sublabel":"审计记录","pos":[300,420],"size":[150,64]}],"connections":[{"id":"checkout","from":"shop_ui","to":"order_api","label":"checkout"},{"id":"reserve","from":"order_api","to":"inventory_service","label":"reserve"},{"id":"update","from":"inventory_service","to":"inventory_db","label":"update"},{"id":"charge","from":"order_api","to":"payment_service","label":"charge"},{"id":"payment_result","from":"payment_service","to":"order_api","label":"payment result"},{"id":"record","from":"order_api","to":"audit_log","label":"record"}]}