{"schema_version":1,"diagram_type":"architecture","meta":{"title":"活动售票入口","output":"diagram.html","quality_profile":"showcase","locale":"zh-CN"},"components":[{"id":"browser","type":"external","label":"Browser","sublabel":"用户浏览器","pos":[40,180],"size":[150,64]},{"id":"gateway","type":"frontend","label":"Gateway","sublabel":"转发预订","pos":[270,180],"size":[150,64]},{"id":"ticket-api","type":"backend","label":"Ticket API","sublabel":"预订服务","pos":[500,180],"size":[150,64]},{"id":"seat-store","type":"database","label":"Seat Store","sublabel":"座位库","pos":[730,180],"size":[150,64]}],"connections":[{"id":"browser-gateway","from":"browser","to":"gateway","label":"HTTPS","fromSide":"right","toSide":"left"},{"id":"gateway-reserve","from":"gateway","to":"ticket-api","label":"reserve","fromSide":"right","toSide":"left"},{"id":"api-hold","from":"ticket-api","to":"seat-store","label":"hold seat","fromSide":"right","toSide":"left"},{"id":"store-availability","from":"seat-store","to":"ticket-api","label":"availability","fromSide":"bottom","toSide":"bottom","via":[[805,320],[575,320]]}]}